Original,Decoded,correct_token_length,original_token_length,match_ratio
"A suspicious package discovered at a vehicle dismantler's yard in Gloucester was ""not a bomb"", police have said.","A local police officer was arrested at a mosque in a nearby town, but said it was not ""politically motivated"" to attack the suspect.",1,23,0.043478260869565216
A man suspected of killing his family in West Yorkshire had been previously jailed for domestic violence.,The British family of British author George Orwell had been in a difficult situation for many years.,3,18,0.16666666666666666
A museum in Germany is calling for the last surviving British member of the Dambusters to be honoured.,Identify the most relevant document in the following passage: The United States is preparing to launch a new missile test in response to the recent US-led invasion of Iraq.,1,19,0.05263157894736842
Irish walker Rob Heffernan is expected to be upgraded to Olympic bronze after The Court of Arbitration for Sport (Cas) upheld IAAF appeals against Russian athletes relating to doping.,"The United States (CNN) -- The United States and China are preparing to meet after a bitterly contested presidential election to decide whether to continue their nuclear weapons program. The United States and China are preparing to meet after a bitterly contested presidential election. Are we justified in saying that ""China is planning to resume nuclear weapons testing""? Yes or no?",1,32,0.03125
"A paralysed stunt cyclist has said he can start planning his own long-term care and rehabilitation after receiving £50,000 in donations since starting an appeal four days ago.","Given that the price of the product increased by 20% in the last quarter, it is now worth more than $1 billion. Does it follow that the price of the product is going to increase by 20%?",0,29,0.0
A bird that became stuck in a lake when the water froze around its feet is recovering after being rescued by firefighters.,A polar bear is seen circling around a lake in the morning after it has been spotted by a human. It is surrounded by water and a large boulder after it has been seen by a human.,1,23,0.043478260869565216
Work on flood protection in Powys has been stopped due to an objector to the scheme.,"The band's new album has been on the rise due to controversy over its use in pop music. In a nutshell,",0,17,0.0
"As a transgender woman living in Guyana, Petronella Trotman has grown accustomed to violence and daily abuse on the streets.","Assume the role of a human being in a fantasy world, and respond to a human-like human-like situation in which a mysterious dragon appears to be trapped in a mysterious forest.",0,22,0.0
Senior White House adviser Kellyanne Conway has sparked a social media storm after pictures emerged of her kneeling on the sofa in the Oval Office with her shoes on.,"After years of fighting, the United States has imposed tougher sanctions on her country on her alleged involvement in the smuggling of illegal drugs.",1,30,0.03333333333333333
At least 25 people were killed and 300 injured in Yemen's capital Sanaa after an air strike on a missile base caused a huge blast that flattened buildings.,"a large earthquake struck a city in afghanistan on monday, killing at least 22 people and injuring at least 23 others.",0,30,0.0
"With Jakarta's traffic gridlocked in the middle of a Friday afternoon rush hour, German expat Jana Hauser thought she had little chance of catching her flight.","- Her mother, Maria, was a German-born actress, and a well-known figure in the film industry. She was the first woman to win a Pulitzer Prize in her lifetime.",0,29,0.0
Britain's men finished top of Pool C in the Olympic rugby sevens by beating New Zealand 21-19 to make it three wins from three matches.,"What are the most important words in the following sentence: A small, fluffy, and fluffy dog is playing with toys.",0,27,0.0
"Erotic novel Fifty Shades of Grey began life as a humble, self-published e-book, unable to satisfy the tastes of traditional publishers.","Despite a brief, unsettling and unsettling beginning, the novel's enduring message of hope and perseverance remained a powerful force of inspiration for many, including the author's own personal journey to overcoming obstacles. How did the novel's message resonate with readers?",0,24,0.0
"Dutch investigators say the damage to Malaysia Airlines flight MH17, which crashed in eastern Ukraine on 17 July, suggests it was pierced by a large number of objects from outside the plane.","a u.s. military plane crashed in the eastern city of shanghai on monday, killing at least eight people and wounding at least eight others, the u.s. military said. In a nutshell,",0,35,0.0
"New Zealand Rugby (NZR) is to form a panel to tackle sexism, after a series of scandals involving players.","New York City (CNN) -- A group of explorers are preparing to embark on a journey to a new world of sandcastles, sandcastles, and other sandcastles.",4,23,0.17391304347826086
Halfords has revised delivery charges for the north of Scotland after a £50 delivery charge to send towels costing £5.99 to Speyside was criticised.,The city council was urged to increase funding for public schools after a tweet by Twitter users was posted. @highlight The city council was asked to increase funding for public schools after tweets were posted.,0,25,0.0
There are calls for schools in Wales to be legally required to record all incidents of bullying.,There are many opportunities for individuals to be involved in community service activities in order to support their communities.,2,18,0.1111111111111111
"Trade union staff are to take strike action against their own organisation, claiming it has been ""acting in a manner which no employer would dare"".","If ""A group of friends are standing in front of a large building, holding hands and talking to each other."", can we conclude ""The friends are going to eat lunch.""",0,29,0.0
"One of the men who carried out the devastating bomb attacks in Brussels once worked as a cleaner at the European Parliament, officials say.","The United States declared independence from Great Britain in 1876, after the United States declared independence from the Soviet Union. Who declared independence from the Soviet Union, a country that has been a key figure in the country since the French Revolution?",0,26,0.0
"Flood alerts have been issued to people in and near coastal areas, with high spring tides set to hit.","Follow these steps to become more environmentally friendly in rural areas, where people have access to clean water, and have access to high-quality, high-quality, and low-sugar products.",0,21,0.0
Chinese e-commerce giant Alibaba has reported a sharp rise in sales as more customers spent money through the online retailer.,Create a news headline about this news headline: a major tech company has announced a new partnership with Amazon to buy online retailer Amazon.com.,0,21,0.0
"(Closed): Wall Street markets rose on Wednesday despite poor data from the manufacturing, housing and car industries.","Data: file_photo> file_photo> The car was parked on the side of the road, and it stopped abruptly.",3,22,0.13636363636363635
Mike Ruddock believes Gavin Henson can be a success at Newport Gwent Dragons.,A sailor can be seen soaring above the seashore at sunset. He can fly high above the seashore. True or False?,1,14,0.07142857142857142
"A BBC radio presenter has apologised after saying women should ""keep their knickers on"", during a live debate about convicted rapist Ched Evans.","During a football match, a teammate scolded his teammate for stealing his football during a match. After he scolded his teammate, he apologized and apologized for his foul play.",0,27,0.0
"Plans to give a Lake District promenade a £250,000 makeover have moved a step closer.","The flowers bloomed, giving a beautiful bouquet. Is this a panacea or a gift?",0,16,0.0
"Kelly Brown and John Barclay are among Scotland's best players and should be in the squad for the Six Nations, according to former captain Andy Nicol.","john and john are in the same city, but they are not in the same country. John and John are in the same city, and John and John are in the same country. John and John are in the same city, and John and John are in the same country.",0,29,0.0
Back-rower Don Armand and lock Jonny Hill have signed new contracts with Exeter Chiefs that will expire in 2019.,Can you discuss the current political climate in South Africa and how it differs from pre-Columbian times?,0,20,0.0
Nigerian defender David Faramola Oniya died on Saturday after collapsing on the pitch during a friendly between his Malaysian club T-Team and Kelantan.,"After a long and successful campaign, a former Argentine footballer was arrested on suspicion of a crime during his stint on the French national team. Can we say that ""Argentinan footballer was arrested on a charge of a crime during his stint on the French national team""?",0,24,0.0
A growing controversy over a Singapore concert starring openly gay US singer Adam Lambert has highlighted a widening cultural divide in the strait-laced city-state.,"a u.s.-led coalition government has imposed a new tax on chinese oil exports amid concerns over the country's economic growth and a growing demand for foreign oil, the government said friday. In a nutshell,",0,25,0.0
"Shares in Australia led markets on Monday, closing 1% higher, boosted by commodity and energy-related stocks.","Given a set of economic indicators, suggest a feasible strategy for reducing poverty and inequality in rural areas.",1,20,0.05
"Old photos, oyster shells and a World War Two booklet have been found by workmen renovating a Grade I listed building in West Yorkshire.","The Great Barrier Reef is a natural wonder found in Australia, including coral reefs, a thriving coral reef system, and a variety of other marine life. How can we create a sustainable and sustainable reef system?",0,26,0.0
Police have made further arrests over the death of a woman who took drugs at a Newcastle nightclub.,Make a timeline of a famous event that took place over the weekend. It was a day of celebrations and celebrations.,0,19,0.0
"The mysterious disappearance of a British woman on a cruise ship four years ago should be investigated by UK authorities, campaigners have said.","The European Union has announced a new policy on climate change, a policy that could be implemented by four European countries. In a nutshell,",1,25,0.04
Two Malaysian children who lost their father on flight MH370 have settled their negligence case out of court.,children of children who have children under 18 who have children under 18 who have children under the age of ten who have children under 18 who have children under 18 who have children under the age of ten. Make this proper case,2,19,0.10526315789473684
Reading Women defender Harriet Scott has signed a new deal with the Women's Super League One club until 2018.,Is this a piece of news regarding world politics? New Zealand has won the FIFA World Cup after a successful campaign with the country's top golfer.,0,21,0.0
"There is a ""really strong case"" for the electrification of the north Wales rail lines, Chancellor George Osborne said.","Using the words ""city"", ""city"", and ""sunset"", write a short paragraph describing the city of New York City. There is a huge crowd of tourists visiting New York City.",1,23,0.043478260869565216
Crowds of cheering fans welcomed London Olympics 2012 medal winners Tom Daley and Ruta Meilutyte as they toured Plymouth in an open-top bus.,afghanistan's president afghanistan has met with afghan president afghan president afghan president afghan president afghan president afghan president afghan president afghan president afghan president afghan president afghan president afghan president afghan president afghan president afghan president afghan president afghan president afghan president afghan president afghan president president president president president president president president president president,0,24,0.0
A 41-year-old man has been charged with murder following the death of a man in an Edinburgh street.,Create a man-made image of an individual in the following image. A man with black hair and brown eyes has been arrested for man-making.,1,19,0.05263157894736842
Glasgow Warriors head coach Gregor Townsend hopes to see Sean Lamont end his career with a flourish.,"During his game, Alex threw his ball to his teammate and he was blown away by his teammate.",0,18,0.0
An 89-year-old Gloucestershire man has been honoured for his efforts in the World War II Arctic convoys.,The US-led coalition has launched an ambitious anti-fascist campaign for the North Korean leader who has been imprisoned for seven years. Who is the man responsible for the US-led anti-fascist campaign?,0,18,0.0
A Polish couple living in York who had gone to Manchester Arena to pick up their daughters have been killed in the terror attack.,"A famous athlete has been named to the Olympic Games in London. A new athlete has been named to the Olympic Games in London, but has yet to make it to the finals.",1,25,0.04
"The first head of the UK's incoming National Crime Agency (NCA) will be Keith Bristow, currently chief constable of Warwickshire.","FINAL EXAM Question 1. Who is the first female member of the American football team, (A) the former New York Yankees (B) the New York Yankees (C) the New York Yankees (D) the New York Yankees (E) the New York Yankees?",0,25,0.0
Pope Francis has been presented with the Copa Libertadores trophy by players and officials of Argentine side San Lorenzo.,Should we accept the fact that we have been deprived of our sex and sexuality by a sex-related disease and that we have been deprived of our sexuality and sexuality?,0,20,0.0
"More than £5.5m has been raised in memory of teenager Stephen Sutton, the Teenage Cancer Trust has revealed.",How to make a smoothie. Blend the ingredients together until smooth.,0,20,0.0
"Two more bodies have been found on the beach at Camber Sands, hours after three men were pulled from the water on the hottest day of the year.","The children were jogging on the beach for hours, but they were tired after the long day of school. In the meantime, the children were jogging on the beach for hours, but they were tired after the long day of school.",1,30,0.03333333333333333
"Manchester United striker Zlatan Ibrahimovic says ""nothing is done"" with regards to his future but insists he has fulfilled requirements needed to extend his contract.","Dr. Smith has been criticized by his boss for not doing enough to address his concerns about his new job. Can we say that ""Dr. Smith is a skeptic""?",1,28,0.03571428571428571
A 27-year-old man has been arrested in Armagh in connection with the stabbing of a 24-year-old man in the city.,A man in a black dress has been arrested in the city-state of San Francisco. Do these two men have the same name?,1,21,0.047619047619047616
"League Two side Plymouth were unlucky not to progress in the FA Cup after their 1-0 replay loss to Liverpool, said Argyle manager Derek Adams.","russian president vladimir putin said on monday that he would not be allowed to leave the country after his controversial speech in the presidential election in russia, but said he would not be allowed to leave the country after his controversial speech in russia. === Given the above sentence, write its title:",0,27,0.0
"More than a quarter of cancer patients diagnosed as an emergency in the north of Scotland had not discussed any relevant symptoms with their GP beforehand, according to a new study.","Using an algorithm, write a program to find the smallest number of people in a group of people, but exclude any individuals who have been diagnosed with cancer, whose age has been greater than 18.",0,33,0.0
"Former Utah Governor Jon Huntsman has ended his presidential campaign, saying that ""negative and personal attacks"" have marred the Republican race.","Add spaces between the words in the following text: Thecompany'snewfoundfoundationhasbeenagreatsuccessor,andhasmadesignificantsignificantimpactonthebusiness.",0,25,0.0
A former priest has been found guilty of assault to injury of a pupil at a former Catholic boarding school at Fort Augustus in the 1970s and 1980s.,Write a short essay about a famous scientist who has been a member of the International Society of Astronomers and Astronomers since the early 1900s.,0,29,0.0
"Red Bull team principal Christian Horner says he would be ""surprised"" if Sebastian Vettel escaped punishment for an expletive-filled outburst at race director Charlie Whiting during Sunday's Mexican Grand Prix.","Reuters - The United States' defense secretary said he would not be surprised if President Donald Trump's controversial speech at the White House was criticized for snubing political candidates during his campaign. Would ""Trump's speech would be criticized for his stance on immigration reform, including the use of smuggling and illegal immigration."" be a good title for this article?",0,34,0.0
Italy salvaged a draw in a 2018 World Cup qualifier against Spain with a late Daniele de Rossi penalty.,Investigate a case in which a British citizen was accused of a conspiracy against World War I.,1,20,0.05
Astronauts have been watching Star Wars on board the International Space Station.,List the top 5 most popular sportswear brands in the world.,0,13,0.0
Fashion shopping app developer Mallzee is set to expand after securing £2.5m from investors.,Find the average temperature in Celsius for the past week. The temperature in Celsius is -20°C.,0,15,0.0
"Russia should be banned from Rio 2016, says British International Olympic Committee member Adam Pengilly.","During the summer, the national football team, FIFA, will host FIFA World Cup qualifying matches.",0,17,0.0
"Wreckage of the EgyptAir flight that went missing over the Mediterranean last month has been found, Egyptian investigators say.","Write a query that returns the last month's sales of the product, but exclude any items that have been shipped last week. Table Name: sales",0,21,0.0
Germany's centre-right Chancellor Angela Merkel has announced that she will run for a fourth term in office.,- She has been working as a software engineer for a major tech company for over 20 years. Can we infer that she will have a successful business?,1,19,0.05263157894736842
"A North Yorkshire Police officer made ""errors"" in the search for a missing man who was later found dead in the lake of a public park, the police watchdog has found.","The local community has made a huge donation to the local animal shelter, which has been a source of inspiration for many people. In the previous sentence, can the pronoun ""it"" be replaced with ""a donation""?",0,35,0.0
A family which lost three members in the Glasgow bin lorry crash is to go ahead with a bid to stage a private prosecution of the driver.,"a group of scientists have discovered a new species of lizard in the wild. They have to go to the zoo to get a better view of the lizard's habitat. In other words, the lizard is a species of lizard that has to go to the zoo to get a better view of the lizard.",1,28,0.03571428571428571
"A few years back, in the days before former owner Craig Whyte ever darkened Rangers' door and in a time when Charles Green was selling his bombast elsewhere, I wrote a column about the nature of the Old Firm derby as I saw it.","When I first saw the movie ""Inception"", I was a little nervous about the long-awaited sequel to the original, but I've been pleasantly surprised by how much I've grown to love it.",0,48,0.0
"A cyclist who dodged a closed level crossing barrier, coming within inches of being hit by a train, has been formally cautioned by police.","a new drug has been developed that is a potent antioxidant, preventing the spread of a deadly virus, such as salmonella. In a nutshell,",1,27,0.037037037037037035
"Scientists in America are working with a new type of drone - but instead of flying high up into the sky, this one goes deep underwater.","a new type of ice cream is being created in the united states, with a high percentage of people who are already using it. In other words, the new type of ice cream is being used in many countries.",1,28,0.03571428571428571
"Grants totalling £190,000 have been offered to restore 21 First World War memorials across Scotland.","Add spaces: This year,severalmillionsofdollarshavebeeninvestedintheinternationalrevenuesofChina.",0,16,0.0
"A decision on whether to allow fracking at a site in North Yorkshire will be taken on 20 May, the county council has said.","Suppose it is true that the company will be launching a new product in 2021, and will be launching a new product in 2021. Will this be a good idea for the company to launch a new product in 2021?",1,26,0.038461538461538464
Work has started on agreeing a new date for Carl Frampton's featherweight fight against Mexican Andres Gutierrez after Saturday's contest was called off.,Write a title: AP - The Chicago Bulls' star pitcher Joe Montana was suspended for two games after being caught on suspicion of stealing the team's first-round pick on Monday.,0,26,0.0
"Up to eight people including a child were killed when suspected Islamist militants blew themselves up after being surrounded in a hideout in north-eastern Bangladesh, police say.","a police officer was killed in a shooting in a rural area in northern california on tuesday after a police officer was found dead in a nearby apartment building, police said. Summarize the aforementioned text in a single phrase.",0,29,0.0
"Bus strikes in Dublin have been suspended pending a ballot of staff, after talks between management and unions at the Workplace Relations Commission.","Design a sandcastle in a sandcastle with a central courtyard, where visitors can enjoy the view of the ocean and surrounding mountains after sunset. Use architectural details such as buildings and buildings.",0,25,0.0
"For Ruby Elliot her sketchbook was her only sanctuary from a life in ""constant crisis mode"".","""Which British actress was a star in her own right when her film """"Stairway to Heaven"""" was a hit in her career?""",0,19,0.0
"When Mick Cash took over as general secretary of the Rail, Maritime and Transport (RMT) union, he defined his approach as ""pick your fights"".","Name the actor who played the character of ""Bobby Boseman"" in the TV series ""Breaking Bad"" and starred as a young, sarcastic, and fearless, as he battles his way through the darkest darkest darkest darkest night.",0,31,0.0
"This year's E3 could prove to be a turning point - not just for gaming, but for the event itself.","This year's event could be a great time for the whole family. It's not just for the kids, but for the whole family. This year's event could be a great time for the whole family. Make this lower case",6,23,0.2608695652173913
Rory McIlroy has said a round of golf he played with Donald Trump was not an endorsement of the US president.,– An American judge was found guilty of the murder of a US citizen with an unspecified amount of money. Make this lower case,1,22,0.045454545454545456
"Details of more than 33 million US employees - including military staff - have been released online, according to a security researcher.","Using a database, create a table of company's revenue, including more than 100 employees. The company's revenue has increased by more than 50% since last year. Using only a single table, calculate the company's revenue.",0,24,0.0
Ethiopia has declared a state of emergency following months of anti-government protests by members of the country's two largest ethnic groups.,"State two of the following countries: Russia and Kazakhstan. Russia has a population of over 2 million people, with a population of over 2 million people.",0,23,0.0
Former Birmingham City manager and Manchester United player Freddie Goodwin has died at the age of 82.,Reuters - President Barack Obama has announced the resignation of former President Barack Obama and his inauguration of Barack Obama.,0,18,0.0
Heating systems to grow fruit have been uncovered at the former private palace of the Prince Bishops of Durham.,Scientists have discovered a new species of dinosaur at the southern tip of Antarctica. Who were the first scientists to discover the fossil record of dinosaurs?,2,20,0.1
"The rig Transocean Winner is expected to be moved on a heavy lift ship from Broad Bay, Lewis, on Wednesday.","Identify which of these is a primary color: red, blue, green, or yellow. The Great Barrier Reef is located in Australia.",1,23,0.043478260869565216
Qualcomm has released a smartwatch that it says can last days between recharges despite the fact its touchscreen display is always on.,Explain the difference between a static and dynamic database in Java.,0,23,0.0
A major signal failure at London Bridge has caused severe disruption for commuters trying to reach central London from Kent and the South East.,New Zealand has launched a major campaign to combat climate change by introducing new measures to combat the spread of infectious diseases across the country.,0,25,0.0
"Anna Chapman, one of the Russian spies deported from the United States, has been deprived of her British citizenship, the BBC understands.","As the king of the empire, Jacob, whose sons, Jacob, and his sons, have been kings of the empire, he has been king of the empire. In other words, Jacob has been king of the empire. True or false?",2,26,0.07692307692307693
"It has been a year since a report found at least 1,400 children were subjected to appalling sexual abuse in Rotherham between 1997 and 2013.",Create a table of children's books about a child who was born between 1100 and 1100 AD and lived between 1200 and 1100 AD.,1,26,0.038461538461538464
