Original,Decoded,correct_token_length,original_token_length,match_ratio
A man who verbally abused staff at Altnagelvin Hospital in Londonderry has been jailed for 10 months.,The man who has been inducted into ncaa Hall of Fame for his role in “Stairway to Heaven” has been awarded a 20-year contract.,2,18,0.1111111111111111
"Spanish bank Santander has reported a rise in net profit in the third quarter compared with a year ago, helped by its performance in emerging markets in Latin America.","Despite a slow start in the final quarter, a successful campaign in Spain has been held in place to increase its lead in a major European championship.",0,31,0.0
"Lewis Hamilton says he is ""feeling that fire inside me"" as he tries to leapfrog Mercedes team-mate Nico Rosberg at the top of the drivers' championship in Hungary this weekend.","- The football player who was drafted by the Chicago Bulls in the 1970s was drafted by the Chicago Bulls in 1970. He is considered to be the greatest football player of all time. - He played for the Chicago Bulls in the 1970s and 1980s. - He won the Super Bowl with a career-high 82 points. What is ""he""?",0,34,0.0
"The United States' likely new spymaster, Mike Pompeo, is a hardline Republican Congressman and a national security hawk with a background in military and intelligence affairs.","The movie is a satirical comedy with a strong cast, a witty dialogue, and a heartwarming storyline, with a strong cast and a strong performance from the lead actor. The sentiment expressed for the movie is",2,30,0.06666666666666667
Sussex completed victory over Leicestershire by an innings and 59 runs inside two days by skittling them for just 119 at Grace Road.,The British Airways flight departed from London on Sunday for London and arrived at London's Royal Albert Dock for an hour and a half. TL;DR:,0,24,0.0
A man suspected of carrying out an attack on a factory near Lyon in France in which a man was found decapitated continues to be questioned by police.,"A man was arrested in an attempted murder in a mansion in New York City, but he was found not guilty of the crime. In a nutshell,",3,29,0.10344827586206896
"Residents are beginning to return to their flooded homes, even as more rains are expected in the state of Louisiana.","State the state of California in California, where California is known for their statewide laws to regulate water use. Are there any state laws that are in place to regulate water use?",0,22,0.0
Wales men's hockey team are through to the semi-finals of the World League 2 tournament with a 3-0 win over Italy.,Watch the video and identify the team's goals. Video of a team's victory over a rival team. Video of a team's victory over a rival team's opponent.,1,23,0.043478260869565216
A number of employees at a DFS furniture store have been suspended over allegations they made fun at the appearance of a customer.,Roleplay as a customer who has purchased a set of headphones at a store and give a rating out of 100 to the quality of their headphones.,0,24,0.0
"Mae diswyddiadau yn ""debygol iawn"" o gael eu cyflwyno ym Mhrifysgol Aberystwyth, yn ôl is-ganghellor y sefydliad.",                                                               ,0,21,0.0
"Being miserable or stressed will not increase your risk of dying, according to the UK's Million Women Study.","According to the United Nations' World Health Organization, it is important to protect your health from harmful harmful radiation.",1,21,0.047619047619047616
"Mercedes driver Nico Rosberg says he is ""disappointed"" with the decision to postpone the introduction of extra cockpit head protection until 2018.","Paraphrase the sentence ""The American President is a member of the British Parliament and is known for his stance on immigration policies.""",1,25,0.04
A video of a blindfolded Muslim teenager in Nottingham giving out free hugs has attracted millions of views on social media.,Write a series of short videos that explore the role of a humanoid in a popular social media platform. Include images of people in action and their motivations.,0,22,0.0
An overgrown Australian sheep affectionately named Chris has set a new unofficial world record following a hair cut from five shearers.,Rewrite the following article as a news headline. A new report has found that over a third of Americans have been diagnosed with cancer after a recent stroke.,1,22,0.045454545454545456
India's Supreme Court has rejected an attempt to stop the government making a controversial biometric identity card mandatory for social welfare schemes.,Make a title for this article: the government has announced plans to increase taxes on tobacco products by reducing the country's carbon footprint.,0,24,0.0
Lisburn and Castlereagh Council is investigating the dumping of tyres at a bonfire site in Dundonald.,a sailor is slain in a sailor's cape and is stranded in the sailor's cape after being caught in the act of slamming a ship. The cape is also used in other battles. Who is the captain?,0,17,0.0
Phil Brown marked his fourth anniversary in charge of Southend with a third consecutive win as his side beat Wimbledon in League One.,"Compare the given two sentences and tell me which one is more persuasive: ""The new policy will increase the minimum wage. The new policy will increase the minimum wage.""",1,24,0.041666666666666664
Facebook is to roll out an app that lets users watch the platform's video content on television.,Playing video games on your computer's hard drive. It's an easy way to check out the latest video game that is available on the market.,0,19,0.0
"Ray McKinnon has left Brechin City to become Raith Rovers manager, with Maurice Malpas standing down as director of football at Stark's Park.",Write a title: AP - Former England captain John Terry has been suspended by England manager Boris Johnson after being caught by scouts during his first Test match with Manchester United.,0,26,0.0
"When Newport County threw a teenage Michael Flynn out of their youth academy for defying club rules, he feared he would spend his life doing his part time job, stacking shelves in the local supermarket.","When a traumatic event happens, a person is rushed to hospital, stricken with a broken leg, unable to recover, and unable to recover. If you were a patient, what would you do to help them recover? - take a nap - take a nap - take a nap - take a nap The best answer is",1,38,0.02631578947368421
"Activity in the UK construction sector expanded at its fastest rate in 17 months in May, boosted by a surprise rebound in homebuilding, a survey says.","Is this a piece of news regarding world politics, sports, business, or science and technology? The Dow Jones Industrial Average fell in the first quarter of this year, averaging a 0.2 percent increase in the first quarter.",0,29,0.0
A hospital doctor who went on the run after covertly filming up women's skirts in a shopping centre has been struck off.,She's been working out in the gym for hours after a workout. She's been practicing out on her own and getting ready for a big performance.,1,24,0.041666666666666664
An Australian man has taken himself to hospital after a venomous redback spider bit him on the penis.,"a man has been arrested on suspicion of stealing a car after the man allegedly took it to police. In other words, the man has been arrested on suspicion of stealing a car after he took it to police.",1,19,0.05263157894736842
A Scottish couple made an unusual bit of British military history when the wife handed over command of an Army unit to her husband.,An American actress has been accused of making an unintentional appearance during her career. Have you ever made an appearance at the age of 30?,0,25,0.0
"The UK has a ""moral"" duty to guarantee the status of EU nationals living in the country ahead of negotiations over its exit, a group of peers has said.","The United States has withdrawn from the Paris Climate Agreement, citing concerns over the impact of climate change on the country's economy. In a nutshell,",2,33,0.06060606060606061
Looters who targeted flood victims' homes in York have been condemned by police.,"Help the audience understand what ""social media"" means in modern-day society. Social media has become increasingly popular in many countries.",0,15,0.0
"Lord Barnard has died at his County Durham castle, his family has confirmed.","Harry has been a successful businessman for his family, having built his own business, and his family has grown exponentially over the years.",1,15,0.06666666666666667
Cornwall golfer Sammie Giles says she is planning to turn professional.,What are some common mistakes people make when trying to learn a new language?,0,12,0.0
Hearts left-back Faycal Rherras has been given a late call-up to Morocco's Africa Cup of Nations squad.,The European Union's 'Status of Commons' has been given to all European Union member states. Question: The European Union's 'Status of Commons' has been given to all European Union member states. True or False?,0,19,0.0
A free school in Berkshire has been officially opened by the Queen.,A famous artist has been featured in the art gallery. Have you seen his work recently?,1,13,0.07692307692307693
Amazon shares have surged more than 18% in after-hours trading after it reported a surprise profit and better-than-expected sales figures.,"After receiving a bad review, American athletes have been criticized for their performance after a controversial performance in their last international competition. Should American athletes be punished after receiving bad reviews?",0,22,0.0
Rangers caretaker Graeme Murty praised his players for answering their critics as they ended Celtic's winning streak.,"The following movie review expresses what sentiment? a savagely sexist and unoriginal satire that screams for revenge on his former boss, who has been accused of murdering his former boss.",0,19,0.0
"Mark Cavendish must finish in the omnium top three at the Track Cycling World Championships to have a chance of competing at the Olympics, says British Cycling technical chief Shane Sutton.","Sally Smith, the best-selling actress in the world, has a sexy, sexy and romantic relationship with the British actress who starred in the latest blockbuster film. She has also been a top-selling actress in the UK, having won three Academy Awards for her role in the film.",0,33,0.0
A report into a planned £1.7bn potash mine has said its economic benefits do not outweigh the harm it would cause the North York Moors national park.,A young girl has been spotted wearing a red dress. It looks like it would fit into the girl's jeans. I would say that the dress would fit the girl perfectly.,1,28,0.03571428571428571
Premier League academy teams will be allowed to play in the EFL Trophy in a one-season trial in 2016-17.,Please add spaces between words: Thenewfeatureswillprovideaswellasthenewfeatures.,0,20,0.0
A 12-seat private box in the Royal Albert Hall close to where the Queen sits when she attends events has gone on sale for £2.5m.,"Using the given data, calculate the average of the numbers 5, 10, and 15.",0,26,0.0
Shrewsbury Town have re-signed striker Stefan Payne from Championship side Barnsley for an undisclosed fee.,Slaughter-stricken Slaughter-stricken Slaughter-stricken Slaughter-stricken Slaughter-stricken Slaughter-stricken Slaughter-stricken Slaughter-stricken Slaughter-stricken Slaughter-stricken Slaughter-stricken Slaughter-stricken Slaughter-stricken Slaughter-stricken Slicker--stricken Slicker--Slick,0,16,0.0
"""Monstrously disrespectful"" thieves have wrecked and ransacked a church in Monmouthshire.","Is ""Mount Everest"" located in Peru? Mount Everest is a rocky, rocky, and rocky mountain range in Peru that is home to thousands of species of birds and reptiles.",0,14,0.0
Firefighters have extinguished a blaze at Japan's famous Tsukiji fish market - the largest in the world and a top tourist attraction.,a world-renowned scuba diver and a world-renowned scuba diver have won the olympic gold medal at the world's top scuba diving event in shanghai this year. Summarize the aforementioned text in a single phrase.,2,24,0.08333333333333333
City regulators have published final rules that make top bank executives responsible for the misconduct of their employees -unless they can show they took steps to stop it.,What are the top-rated projects that can be implemented to make it easier for students to learn? - The project's developers have developed a new feature that allows students to track their progress and track their progress.,0,29,0.0
Glamorgan's Colin Ingram and Luke Wright of Sussex hit the first T20 Blast centuries of the summer in a high-scoring clash at Arundel.,Assume the role of a historian and analyze the impact of the French Revolution on the lives of French-born poets like Jean-Paul Sartre and Jean-Paul Sartre.,0,25,0.0
Fire crews had to free a 79-year-old woman who was trapped under a car following a crash in Blairgowrie.,Are the following two sentences conveying the same information? A woman was found dead in a car wrecked by a car in a nearby suburb. A woman was found dead in a car wrecked by a car in a nearby suburb.,0,20,0.0
A woman who became a campaigner against domestic violence after her son was killed by his father last February has been named Australian of the Year.,The American singer who was born after his father died was a member of the band Queen who was also a member of the band Queen. Who was born after his father died after his father died?,1,27,0.037037037037037035
"A Belfast businessman has said he has hundreds of hours of tapes showing an ""ingrained culture of inappropriate and possibly illegal conduct"" across political, banking, legal and accountancy sectors.","This is an email: We have a new policy of a new policy of a new policy of a new policy of a new policy of a new policy of a new policy of a new policy of a new policy of a new policy of a new policy of a new policy of an old policy of ""sustainability"", which includes the elimination of all forms of social media, including social media, and online advertising. Please review and approve your response.",1,34,0.029411764705882353
"The cost of a cuppa will have to rise, according to the boss of Typhoo.","According to a recent poll, the majority of Americans are likely to opt out of a membership of the American Red Cross.",0,17,0.0
Two soldiers from 1st Battalion Irish Guards killed in Afghanistan just six days before they were due to return home have been named.,"We were all tired of being sucked into bed by our parents for days, so we decided to wake up early. Are we still in need of sleep?",0,24,0.0
"Aberdeen councillors are being warned they face prison or fines if they break London Stock Exchange laws on insider dealing, BBC Scotland has learned.","Assume it is true that NASA has launched a new mission to Mars. They are investigating whether astronauts are on Mars, and what are their potential dangers if they land on Mars?",0,26,0.0
Burnley celebrated boss Sean Dyche's new contract by beating leaders Hull City to close within a point of them.,The CEO of a major tech company announced layoffs due to financial difficulties. Can you provide a detailed explanation of how these layoffs could lead to layoffs?,0,21,0.0
Oxford United have signed midfielder Ivo Pekalski from Swedish side Halmstads for an undisclosed fee.,I've been eyeing an exotic exotic animal for years. I've been eyeing an exotic animal for years. I've been eyeing an exotic animal for years. I've even been eyeing an exotic animal for years. I've been eyeing an exotic animal for years. /example>,0,16,0.0
Manchester City midfielder Yaya Toure has signed a new four-year contract with the Premier League club.,"Come up with a four-word title for a British-language television show featuring the British actress, actress-turned-actress.",2,17,0.11764705882352941
Six pets worth thousands of pounds have been stolen from a dog walker's van in south London.,Describe the mental health benefits of a dog's barking in dogs.,0,19,0.0
"Anton Yelchin did not write a will before he died and left behind a $1.4m (£1.06m) estate, according to court documents filed by his parents.","During his first day at work, he forgot his lunch and was unable to finish it. He woke up late and forgot his lunch. Did he finish his lunch?",0,30,0.0
Crawley completed a double over Newport County with a comfortable 2-0 victory.,Here is a premise: A cyclist crosses a road over a paved road. How do cyclists navigate through this obstacle?,2,13,0.15384615384615385
A cat has been rescued from under the bonnet of a van after travelling about 60 miles in a space behind the heater matrix.,"After a long time in the wilderness, a man has been rescued by a helicopter after being trapped under the cover of a huge tree.",0,25,0.0
A 15-year-old girl who was allegedly sent indecent messages by former US congressman Anthony Weiner has criticised the director of the FBI.,Actor Robert Downey Jr. was the former US President who served as the US Secretary of State from 2009 to 2017. He is widely regarded as one of the greatest American aviators of all time. Question: Who is the former US President who served as the US Secretary of State?,1,23,0.043478260869565216
It's strange to go to the cinema and come out feeling like you've seen an utterly brilliant film and a truly awful film at the same time - but the new Baywatch really does tick both boxes.,"'s an exciting and thought-provoking film that's not only about the story and its characters, but also about the film's witty and heartfelt story. Do you want to see this film again?",0,40,0.0
(Close): Disney shares closed down 9% after disappointing earnings figures sparking share price falls in rival cable companies.,Reuters - US stocks fell 5% in early trading on Thursday after a major stock market crash. (Reuters) Reuters - US stocks fell 5% in early trading on Thursday. (Reuters),0,23,0.0
Dunfermline climbed to the top of the Championship with an emphatic victory at Dumbarton.,Which of the following sentences contains an oxymoron? The cat sat on the mat.,0,15,0.0
Shares in banknote printer De La Rue tumbled almost 9% after the firm reported lower full-year profits and cut its dividend by 40%.,"Do you think the right answer to the question ""who played the lead role in the 1994 film """"The Road"""" by Roberto DiCaprio and Michael Jackson? (A) Michael Jackson (B) George Harrison (C) George Harrison (D) George Harrison",1,26,0.038461538461538464
London Irish number eight Rob McCusker believes confidence can flourish among his team-mates after their crucial Premiership victory against Worcester.,"This text is missing some spaces, please add them: Thebestwaytogetanewcarisinthemarketistobuyanewcar.",0,21,0.0
"Care firms have cancelled contracts with 95 UK councils, saying they cannot deliver services for the amount they are being paid, a BBC Panorama investigation has found.","Assume it is true that the study found that people who exercise regularly have lower rates of depression, anxiety, and depression. According to a recent study, those who exercise regularly have lower rates of depression, anxiety, and depression. Therefore, ""What are the benefits of exercising regularly?""",0,31,0.0
"Russian Aleksey Troshkin won the Jersey Marathon for the third year in a row, with his time of two hours, 18 minutes and 28 seconds just outside his own course record.","Can you find the year in which the first season of ""Breaking Bad"" premiered? The first season of ""Breaking Bad"" was released in 1997, and it has been a critically acclaimed film for over two decades.",0,34,0.0
"Emi Mahmoud, the reigning World Poetry Slam Champion, has written a poem for the BBC 100 Women season.","The legendary wrestler, who has won the WWE Super Bowl for the second year in a row, has won the WWE Super Bowl for the second time, beating the Atlanta Falcons, a seasoned veteran. Have you watched the WWE Super Bowl?",0,21,0.0
"North Korea says its firing of a missile over Japan was ""the first step"" of military operations in the Pacific, signalling plans for more launches.","""The Great Wall of China"" is a series of fortifications built along the northern borders of China for centuries. It was built over the course of its construction, and is considered one of the ""greatest natural wonders"" of the world.",0,29,0.0
Additional checks are being carried on a North Sea helicopter fleet in the wake of safety fears.,Consider the potential consequences of a nuclear war on civilian populations in developing countries.,1,18,0.05555555555555555
A 38-year-old man is due to appear in court charged with the attempted murder of a Catholic police officer in 2008.,A man in California is charged with a man-in-the-middle theft of property in the United States. Are these charges related to the same crime?,1,22,0.045454545454545456
"A hotel in the heart of Cardiff has admitted ""unacceptable"" failings, after a BBC Wales investigation uncovered dirty rooms.","Given a news article, summarize the main points of the article: ""An investigation into a recent suicide bombing in the city has revealed that a woman has been arrested for stealing police cars. """,0,23,0.0
A woman has been charged with murdering a 75-year-old man and with attempting to murder a woman on the same day.,Do these two sentences have the same meaning? A man with a black-haired wife and a man with a black-haired wife is on a date with his wife on April 27.,1,22,0.045454545454545456
Ciaran Clark scored an agonising own goal as the Republic of Ireland were held to a frustrating draw against Sweden in their opening Euro 2016 fixture in Paris.,The United Nations has issued a statement condemning the use of nuclear weapons in developing countries as an unsustainable and unsustainable way of preventing further nuclear attacks. Can you identify the topic of this article?,2,29,0.06896551724137931
"Former Australian Prime Minister Tony Abbott has said his decision to award Prince Philip a knighthood was ""injudicious"".","The US Supreme Court has ruled that British Prime Minister John Howard was a ""suspect"" to his controversial Brexit deal.",0,21,0.0
"Nigeria's airport in the capital, Abuja, has reopened six weeks after it was closed for urgent repairs.","After a long day of work, Maria went to the gym, jogging, swimming, and watching TV.",2,21,0.09523809523809523
"An apprentice joiner from Hawick has won more than £20,000 from a £3 football bet.",Find the topic. Question: What is the capital of France?; Answer: Paris; Topic:,0,16,0.0
A 91-year-old former soldier has been awarded one of France's highest honours for his role in the D-Day landings.,Write a title: The world's oldest-known musician has been inducted into the prestigious 2021 Academy Award for Best Actor.,0,21,0.0
Eighteen new first class stamps are being released by the Royal Mail to celebrate the Star Wars movies.,I heard that Alex is planning to attend the first film festival by the new artist. Alex's first film festival is being planned by Alex. And I was wondering How will Alex react to the new artist's plans? Answer:,0,19,0.0
Would you take your children out of school during term-time?,Look up your school-age child-friendly school-age child-friendly school of thought during school-age. What would you say during school-age school?,1,11,0.09090909090909091
"Reports of thousands of small fish being washed up on beaches in Ceredigion and Gwynedd are no cause for concern, said Natural Resources Wales (NRW).","I'm an administrator on the website Quora. There are many articles on ""Climate Change in India"" (Quora). They are written by experts in different fields such as agriculture, forestry, and biotechnology. Can you recommend some articles on ""Climate Change in India"" (Quora)?",0,29,0.0
Russia is honouring Scottish veterans of the World War Two Arctic Convoys at a ceremony in Glasgow.,The Great Wall of China is a series of fortifications built along the northern borders of China in response to World War II. Question: Where is the Great Wall of China located?,0,18,0.0
Scientists have discovered a species of ancient mammal that survived the event that led to the end of the dinosaurs.,Scientists have discovered a new species of dinosaur that lived at the foot of the Bering Strait.,5,21,0.23809523809523808
The Scottish Professional Football League is considering the use of facial recognition technology at stadiums to help combat anti-social behaviour.,"Use the word ""smartphone"" to help reduce the use of facial recognition technology. The use of facial recognition technology is becoming increasingly popular.",0,21,0.0
"The partner of a woman killed with ""demonic savagery"" exchanged explicit texts and photos with the woman accused of her murder, a court has heard.","Write a one-sentence story of a woman named ""Jane"" with a mysterious and mysterious past, with the words ""hero"", ""hero"", and ""heroine"".",2,29,0.06896551724137931
A project aiming to tackle violence suffered by parents at the hands of their children has been hailed a success in Doncaster.,"a popular cartoonist has been accused of stealing children's toys from a school in the United States. In a nutshell,",0,23,0.0
"A beach brawl on the French island of Corsica between three families of North African descent and local youths has left five people injured and three cars burnt out, regional prosecutors say.","Take the following as truth: The world's three most populous cities are Los Angeles and Beijing, and have three major airports. They have three major airports, three major airports, and three major airports. Then, list three other important factors that affect the economy and the people's lives.",1,34,0.029411764705882353
