Original,Decoded,correct_token_length,original_token_length,match_ratio
A man claiming to be a police officer raped a teenager at knifepoint after stopping her on a street in north London and accusing her of shoplifting.,"After a long and grueling wait for her to arrive in a hospital, a woman was rushed to a hospital in a crowded area with her hands swollen and her face ached after a police officer tried to stop her from stealing her wallet. Write a short summary in a sentence or less",0,28,0.0
"Asian stock markets held on to gains in Thursday trading, following the positive trend from US and European markets.","Provide a positive review for the following hotel chain, with positive reviews in terms of cleanliness and service.",1,21,0.047619047619047616
"A top Islamist militant who ordered a deadly attack on an Algerian gas plant two years ago has been killed in a US air strike in Libya, officials say.","A man in a military uniform is spotted in an airstrip on a deserted island in South America. The two men are seen in an aerial shot of two soldiers, one in an airstrip and another in an airstrip. Which person would be more likely to survive the attack?",1,31,0.03225806451612903
At least four major US firms have pulled millions of dollars in advertising from Google’s platform amid rows over extremist content.,Recommend four major government-owned airlines in Europe that offer at least one-way flights within four hours of departure.,0,24,0.0
"The sizzling summer of 1976 caused permanent changes to British forests, new research suggests.","Research new ways to reduce stress, such as reducing stress levels or reducing stress.",1,16,0.0625
"Pop star Katy Perry is facing the wrath of Indians online after uploading an image of the Hindu goddess Kali with the caption ""current mood"".","Find the name of the actress who is portrayed by the following actress: ""Sarah Winfrey is an actress known for her role as the ""Sarah Winfrey"" in the ""Sarah Winfrey"" movie series.""",0,28,0.0
Four more people were rescued overnight from a hotel in Italy destroyed by an avalanche three days ago.,Create an ad campaign promoting three people who were rescued from a mysterious cave in Peru three years ago.,0,19,0.0
Three of the UK's top tea brands have stopped buying from a group of Indian plantations after a BBC investigation exposed dangerous working conditions.,"As part of a group of scientists, researchers discover a new species of bird that lives in the Amazon rainforest. In a recent survey, 80% of participants reported hearing about bird migration patterns.",0,26,0.0
Jonny Bairstow's second century of the series helped England recover from another top-order collapse to reach 279-6 on day one of the third Test with Sri Lanka.,"Name two of the two greatest battles of the 2nd century between the Ottoman Empire and the Roman Empire, which took place on April 2nd.",0,29,0.0
Gareth Southgate will feel a sense of cautious optimism after his first two matches as permanent England manager in succession to Sam Allardyce - but some familiar questions remain.,a second swedish footballer was injured in a second match after two first-half goals from his left flank and first-half goals from his right flank were a goal in the first half. This is all lower case. Can you fix that?,0,30,0.0
The ancient remains of two human-like creatures found in South Africa could change the way we view our origins.,The new study suggests that humans could potentially live in the same planet as humans by 2050. Could we reduce our carbon footprint by using more fossil fuels?,1,20,0.05
"Authorities are searching for a suspect who hurled a homemade incendiary device into a crowded restaurant in Pasadena, California.","Ada Lovelace is a renowned photographer, known for her work in capturing a candid portrait of a stray dog.",2,21,0.09523809523809523
League One club Charlton have signed left-back Lewis Page from West Ham for an undisclosed fee.,Suggest an alternative for this story. Joanne left her home for work on Monday after being taken to St. Louis for a week-long trip.,0,17,0.0
"In the sun-bleached corner of Nelson Mandela's old prison yard on Robben Island, the desiccated remains of a tiny, weed-ridden garden lie exposed and sadly neglected.","Scientists have discovered a new species of dinosaur in the Amazon rainforest, named ""Samantha, a sailor of the ancient Egyptians"". The dinosaur, named Samantha, was a sailor of the ancient Egyptians, and lived on the island of Madagascar for over a century. Are we justified in saying that ""Samantha is a dinosaur""?",0,30,0.0
A County Tyrone woman who won £27m in the Euromillions draw in 2013 has been ordered to complete 150 hours of community service after pleading guilty to assaulting a taxi driver.,"A former footballer who played in the Chicago Bulls for 20 years has been arrested for a string of alleged drug trafficking in his hometown. Can we say that ""A former footballer who played in Chicago Bulls for 20 years has been arrested for drug trafficking in his hometown""?",1,32,0.03125
Rafael Nadal reached the BNP Paribas Open quarter-finals in Indian Wells after winning the last five games to beat Alexander Zverev 6-7 6-0 7-5.,Identify the topic. Question: How many people are in the United States?; Answer: Approximately 80% of the population is African Americans; Topic:,0,25,0.0
What adjective would you use to describe England batsman Kevin Pietersen?,What adjective would you use to describe “sad” to describe someone who loves to dance?,7,12,0.5833333333333334
A charity has won a Queen's Award for Voluntary Service in Jersey.,A popular tourist attraction in Europe is hosting a gala dinner for 20 guests.,1,14,0.07142857142857142
"A major pro-government rally in Hong Kong is drawing in thousands of supporters, in response to civil disobedience campaigns by activists.","The United Nations is calling for urgent action to address climate change in South Sudan. In a statement, the United Nations is calling for urgent action to address climate change in South Sudan.",0,23,0.0
One of the world's biggest ships has begun a new era for the North Sea oil and gas industry.,a new technology has been developed for the world's largest oil refinery and the world's largest oil refinery - and the world's largest oil refinery - to improve its performance and efficiency.,0,21,0.0
"David Haigh, the former managing director of Leeds United, has been appointed as a committee member at Cornish non-league side Penzance AFC.","Suppose The former British Prime Minister, Winston Churchill, has been a member of the British Parliament since his death in December 2001. Has Winston Churchill ever been a member of the British Parliament?",1,25,0.04
IBF world champion Lee Selby is confident his next fight will be against new WBA world featherweight champion Carl Frampton.,World Cup finalist Kevin Durant will be suspended for three games after being caught cheating on World Cup qualifying.,0,21,0.0
Detectives searching for a serving police officer who has been missing for six days have arrested a 49-year-old man on suspicion of murder.,Is this a piece of news regarding world politics? A new campaign has been launched for a new anti-bullying campaign targeting teenagers aged 14-24.,0,24,0.0
Sir Bradley Wiggins refused to confirm whether he plans to retire after winning the Ghent Six Day event alongside fellow Briton Mark Cavendish.,Follow-up on the latest news: President Trump announces plans to resign after being impeached by Russian forces.,0,24,0.0
A United Airlines flight from Belfast to Newark has been diverted to Manchester Airport.,New York City to host Olympic Games in 2020. Title:,0,15,0.0
"Singer-songwriter Colin Vearncombe, who performed under the name Black, has died at the age of 53, two weeks after being injured in a car crash.","Who is the name of the two men who were killed in a car bomb attack in the city of Bombay, after a man, aged 21, was shot dead by a police officer after being shot twice, the official said.",0,29,0.0
A pregnant woman was among three people targeted when bleach was thrown from a car in two separate attacks.,Consider a situation in which two people were arguing about whether a car was safer than an SUV in terms of safety.,1,20,0.05
Nine people had to be treated in hospital for shock after witnessing an incident on the M27 at Southampton.,Create a list of five hobbies that can be done indoors.,0,20,0.0
"When a group of baby geese got stuck on the roof of a university building in Canada, fast thinking staff decided to help.","How to build a birdhousebr>Start with a small area of land, with a group of people working together in a group. Then, the group of people work together to build a birdhouse in a small area of land.",2,25,0.08
Google has again rejected the EU's objections to how it displays shopping links in its search results.,"Is it possible to use the phrase ""strike against prejudice"" in the same way in this article? The government's new policy has led to widespread protests and protests.",0,19,0.0
"After successive relegations, Blackpool won their first game in the fourth tier since 2001 with victory at home to Exeter.","After a first-half TD loss, the New York Yankees were able to win their first NBA championship in over a decade. In the first half, the New York Yankees were able to win their first NBA championship.",1,22,0.045454545454545456
"My shiny red rental Fiat 500 wound its way up and round the narrow, olive-tree lined lanes like a ladybird humming through the Tuscan countryside.","Assume you are a food critic. A customer has complained about the taste of a sour, sweet, and salty snack. Provide a counterargument to this criticism.",1,27,0.037037037037037035
"In 2008, Petrobras and its main stakeholder - the government of Brazil - hit the jackpot.","In the United States, the United States and Russia have agreed to re-elect the president of its governing body, the White House. Can you identify the main topic of this article?",1,18,0.05555555555555555
Actor-turned-artist Shia LaBeouf will no longer face assault charges over a January incident at his anti-Donald Trump art installation.,Do you think the following statement is true? The U.S.-based anti-fascist group Al-Qaida has been accused of a string of anti-fascist attacks against its members.,0,20,0.0
"The father of a vulnerable teenage boy, who has been missing from his home for more than a week, has appealed for him to get in touch.","The new doctor has prescribed a new medication for his patient, which has been effective for a few weeks, but has been unable to take it in a week. In other words, has the new medication been effective for a few weeks?",3,30,0.1
"Detectives investigating the ""brutal"" murder of a sex worker in Leeds have released a picture of the victim.","Write a summary of the plot of ""Pride and Prejudice"" by Jane Austen, a novel set in the fictional world of a wealthy wealthy investor.",0,21,0.0
"The US Secret Service has released new details of last week's White House fence-jumping incident, in which an intruder was discovered just steps from the main building.","The first episode of the popular TV show, The Office, was released last week. The show's main character was an elderly man who was stranded in an abandoned house in New York City. What was the main character's name?",1,30,0.03333333333333333
"Taliban insurgents in Afghanistan have killed at least 22 security force members in an ambush in Sar-e-Pol province north of Kabul, officials say.","AmeriGas, an American multinational technology company, has announced plans to invest in more than 1 million smartphones in India, including smartphones in India. Should we assume that ""AmeriGas is an important player in the global tech industry.""?",1,25,0.04
A teenager from Lancashire has denied trying to travel to Syria to engage in acts of terrorism.,A group of scientists has discovered a new species of dinosaur in Argentina. They have been able to safely navigate through this ancient world to bring it back to life. Will this discovery lead to further discoveries?,2,18,0.1111111111111111
"A Kirkintilloch woman reported missing, after last being seen on Saturday night, has been found safe and well.","The new car has been on the road for several hours, and has been sluggishly moving. Have you seen any new cars recently?",0,21,0.0
Commonwealth champion Jodie Stimpson won the opening race of the 2016 World Triathlon Series in Abu Dhabi.,What are some common types of graffiti?,0,18,0.0
"Italy must step up efforts to contain a bacterial disease blighting olive trees in the southern province of Lecce, the European Commission has warned.","- A zoo in the Netherlands has opened up to visitors, bringing together a variety of animals, including lions, elephants, and other endangered species. - The park has been attracting visitors to its zoo since the opening of its doors in 1912.",0,26,0.0
The Co-operative Group has revealed it made a profit of £124m in 2014 compared with a loss of £255m the previous year.,The year of the infamous 'Battle of the Somme' was a year of a total of 66 years in which the British Empire lost its power and became a global power. Make this lower case,1,23,0.043478260869565216
Bristol De Mai romped home to win the Peter Marsh Chase at Haydock as the well-touted Alary disappointed.,Add commas to the following sentence: Thedogdogdoesn’twanttobeinthehouse.,0,19,0.0
"Goalline technology will be used in this season's Championship play-offs before being introduced in all second-tier matches in 2017-18, the English Football League has said.","In 2018, the team's first-ever field goal in the 100-meter dash was scored in overtime, helping it to win in both sets. Based on the previous passage, is it true that ""The team's first-ever field goal in 100-meter dash was scored in overtime.""?",0,28,0.0
UK intelligence agency GCHQ has announced it will pay £250 per week to students attending its Cyber Summer Schools this year.,The United States has announced that it will be implementing new sanctions against Russia this year. Should this be a serious issue or should it be considered more serious?,2,22,0.09090909090909091
A gang of men who assaulted a County Tyrone pensioner during a robbery threatened to shoot two neighbours who came to his aid.,a chinese police officer was arrested monday after a smuggling ring to two chinese soldiers and two civilians during a two-day operation to stop two chinese terrorists from entering the country. TL;DR:,1,24,0.041666666666666664
"Ex-Premier League footballer Andrea Dossena has been arrested on suspicion of shoplifting at London department store Harrods, the BBC has learned.","Do you have any recommendations for the next season of The Matrix? The Matrix has been a multi-sports entertainment platform for the Los Angeles Lakers. The Lakers have won numerous Grand Slam singles titles, including the Super Bowl.",0,23,0.0
Some 30 campaigners have occupied a former town hall and magistrates' court in Stoke-on-Trent.,'The Great Gatsby' is a novel written by F. Scott Fitzgerald and published in 1925. It tells the story of a young girl who discovers a mysterious world and returns to her childhood home.,1,16,0.0625
Defending champions Ivory Coast have been given extra financial support for the 2017 Africa Cup of Nations finals.,Is the given news article sarcastic? The United States has announced new sanctions for alleged anti-government activities.,1,19,0.05263157894736842
"Former BBC presenter Julie Wadsworth, accused of sex offences against under-age boys, is the victim of ""poisonous and untrue"" allegations, her defence claims.","""St. Louis Cardinals"" is a team of footballers, coaches, and coaches. They are known for their teamwork and dedication to their teamwork. Keeping in mind the above text, consider: ""St. Louis Cardinals is a team of footballers, coaches, and coaches."", is this always, sometimes, or never correct?",0,29,0.0
Funding of £1.5m will be used to help West Yorkshire Police review 55 unsolved murders.,A new survey shows that 70% of Americans are using e-cigarettes. Can you suggest some eco-friendly alternatives?,0,16,0.0
Yannick Bolasie's 11-minute hat-trick helped Crystal Palace humiliate relegation-threatened Sunderland.,- afghan-born afghan-born afghan-born afghan-born afghan-born afghan-born afghan-born afghan-born afghan-born afghan-born afghan-born afghan-born afghan-born afghan-born afghan-born afghan-born afghan-born afghan-born afghan-born afghan-born afghan-,0,12,0.0
England captain Eoin Morgan says his side have the confidence to beat New Zealand in Cardiff on Tuesday and reach the Champions Trophy semi-finals.,New York City's Mayor Annette Johnson has announced plans to build a new subway system in the city's downtown area. She plans to expand the subway system to include trains and buses.,1,25,0.04
A new £37m home for York City FC will not be finished until part way through the 2016/17 football season.,Create a title: A new home for the first time since the 2010 season will be home to over a million fans.,0,21,0.0
"China is the ""leading suspect"" in the massive hack of a US government agency holding the personnel records of millions of Americans, US intelligence chief James Clapper has said.","US President Donald Trump is a former US president who served as the president of the United States from 2009 to 2017. Output ""True"", ""False"", or ""False"":",0,33,0.0
"Nid yw cynghorau yn gwneud y gorau o arian sy'n cael ei roi iddyn nhw i helpu pobl sy'n cael trafferth talu rhent, medd elusen, Shelter Cymru.","nasa, nasa, nasa, nasa, nasa, nasa, nasa, nasa, nasa, nasa, nasa, nasa, nasa, nasa, nasa, nasa, nasa, nasa, ",1,30,0.03333333333333333
A fire station in Northumberland is facing closure amid £500k budget cuts.,Select which instrument is string or percussion. Azerbaijani folk song is popular in Bangladesh.,0,13,0.0
Grassroots racing will receive an extra £9.7m in 2018 under new proposals from the British Horseracing Authority.,a series of samsung galaxy s6 models will be released in an effort to make the galaxy's galaxy more powerful by using the latest galaxy-score processors. This is all lower case. Can you fix that?,0,18,0.0
"Workers need to earn about £38,000 a year to afford a mortgage in Yorkshire and the Humber region, a report said.","a new report from the federal government shows that a $1.5 billion bond was issued to a woman in a state in the state of florida, $1.5 billion in a federal bond, and $1.5 billion in a federal bond.",0,23,0.0
The government has commissioned an independent assessment of paramilitary organisations in Northern Ireland.,Recommend an environmental policy initiative in Australia that has been aimed at reducing carbon emissions.,0,14,0.0
"An appeal to pay for cancer treatment for the lead singer of indie band Delays has reached its £100,000 target in 48 hours.","Name an American singer known for his work in the chorus of soulful, soulful songs for over 20 years.",1,24,0.041666666666666664
"After seven years of talks, MEPs will finally decide whether to ratify the EU's trade deal with Canada during their plenary sitting in Strasbourg this week.","Classify the following list of countries into countries that will be in the European Union during the 2020s, excluding those that have been ruled out during the European Union's presidential election.",0,29,0.0
He's 20 and a Northern Ireland U21 international.,He's a 20-year-old and has 4 children.,2,10,0.2
Kyle Lafferty scored on his debut to give Hearts a 1-0 win over League Two Elgin City in the League Cup.,Tom Brady won a PGA Tour title in the finals. He scored a goal and scored a goal in the finals. Who scored the winning goal?,0,22,0.0
Convicted paedophile Christopher Paul Neil has been released from custody and will settle in Vancouver.,"The album ""Thriller"" by Michael Jackson was released in 1997 and has since been reissued in numerous countries. Can we say that the album has been critically acclaimed?",0,16,0.0
A list of the country's top 20 cycling collision hotspots has been drawn up by the charity Sustrans Scotland.,"China's top-ranked golf club announces it's opening day of the world cup. In other words, what are the top-ranked golf tournaments of the world?",0,21,0.0
Birmingham City boss Harry Redknapp has been given the all-clear by doctors after emergency cancer surgery.,Transform the given text by replacing underlined words with appropriate words. The world has been ravaged by global warming.,0,17,0.0
"Notts County Ladies players will be allowed to sign for other sides after the club were liquidated, despite the English transfer window being closed.","the u.s. government will be imposing new sanctions on foreign companies after the country's oil prices were hit hard, as oil prices were expected to rise further after the new sanctions were announced. In a nutshell,",0,26,0.0
The government has started the process of selling more student loan debt to the private financial sector.,The government has announced the creation of a new student loan program. Who has the authority to set student loan rates?,7,18,0.3888888888888889
Finding savings and fending off cuts has dominated the policing debate in England and Wales for more than five years.,"a chinese tv series has been rated five times in terms of its quality and popularity, and has been rated by the BBC for its best drama series in five years.",0,21,0.0
"It's the last rites of the 2015 Parliament - and in a frenzy of last minute deal-making, the legislation which can be completed will be rushed to the finishing line, while all manner of bills and other parliamentary business is dropped for lack of time.","a spokesman for the u.s.-based senate and the u.s.-led coalition of the united states and the united states will meet in the upcoming presidential election on thursday to discuss the long-term future of the united states, while the u.s. and the united states will discuss the long-term future of the united states. Instruction: Make this proper case",1,49,0.02040816326530612
Japan has restarted its first nuclear reactor under new safety rules following the 2011 Fukushima disaster.,"Subsequently, the United States has announced that it will be implementing new sanctions against China over its nuclear program. Who has been the first U.S. President?",0,17,0.0
England hooker Dylan Hartley has been handed an eight-week ban for biting the finger of Ireland's Stephen Ferris.,"The Queen's Park is an urban park in Queen's Park, Queen's Park. It has been named after Queen Elizabeth II for her role in the Queen's Park.",0,20,0.0
"Veteran Tory Ken Clarke has waded into his party's war of words with UKIP by branding them ""a collection of clowns"".","Assume the role of a historian and analyze the following piece of news: ""A group of scientists have discovered a new species of dinosaur in Peru's Amazon rainforest. They are examining their evolution into a new species of dinosaur known as ""Saturnia"".""",1,25,0.04
"Mae cwpwl, o dde Cymru yn wreiddiol, wedi cael eu llofruddio yn Ne Affrica.",                                                               ,0,17,0.0
An Egyptian judge has quashed a government decision to hand control of two Red Sea islands to Saudi Arabia.,You need to write a government policy proposal to combat a global pandemic. The government has proposed a series of measures to combat climate change.,1,20,0.05
"Police cuts in England and Wales are ""here to stay"", the head of the police watchdog has said.","According to the article, the local government has proposed cutting funding for public schools. Are we justified in saying that ""everyone in the city has already been affected by the new funding""?",0,22,0.0
The process which led to the decision to house the Great Tapestry of Scotland in Tweedbank is to be the subject of an investigation.,The task is to predict the length of an experiment to be done in the US. The process of decomposition is called the process of growing plants.,2,25,0.08
A man died and a 90-year-old woman was injured in a collision with a motorcycle on a busy road in Hastings.,Come up with a story about a man in a white dress and an old man in a black dress.,0,22,0.0
"The grey, unassuming Sir Geoffrey Howe, now Lord Howe of Aberavon, is not many people's idea of a political hero - but a new play opening in north London aims to change that.",how to make a beautiful symphony                                                          ,0,38,0.0
Claims that the classification system for disabled athletes is being manipulated to boost medal chances has been rejected by British Paralympic Association boss Tim Hollingsworth.,The United Nations has announced that it is suspending all human rights activities for a country that has been accused of violating international human rights laws. The move has been condemned by the UN Human Rights Commission.,0,26,0.0
ITV has apologised for showing a news item about Sir Lenny Henry receiving a knighthood that briefly featured footage of TV cook Ainsley Harriott.,"Write a review for a sci-fi film that fails to deliver a satisfying finale. It lacked a compelling storyline, but it managed to pull off a thrilling finale that left audiences engrossed in the action.",1,25,0.04
Newcastle United captain Fabricio Coloccini has written an open letter to fans calling for unity as the club battles to stay in the Premier League.,Create a CSS rule to apply gradient gradients to the text in the following text. The default background color for the text is Blue. The default background color for the text in the text is Green.,1,26,0.038461538461538464
